{
  "registry_version": "0.1.0",
  "capture_surface_version": "0.2.0",
  "methodology": "exception-capture-completeness-v0.1.0: rules match deterministic scenario signals. Global block signals suppress outbound packets. Matching rules emit candidate packet classes; they do not prove source truth or authorize repo mutation.",
  "global_block_signals": [
    "contains_hidden_chain_of_thought",
    "contains_private_rows",
    "contains_prompt_injection_like_text",
    "contains_raw_log_blob",
    "contains_secret_or_pii"
  ],
  "rules": [
    {
      "rule_id": "exception-capture-rule:asset-suggestion",
      "pattern_family": "asset",
      "description": "A repo created or discovered a reusable digital asset that may help other repos.",
      "min_capture_surface_version": "0.1.0",
      "match_signals": ["new_reusable_asset", "cross_repo_reuse"],
      "any_signals": ["asset_schema", "asset_docs", "asset_script"],
      "suppress_signals": [],
      "emit": {
        "packet_classes": ["ordinary_mail"],
        "mail_message_type": "asset_suggestion",
        "exception_event_type": "",
        "capture_contract": "",
        "severity": "info",
        "required_fields": ["asset_id_or_path", "safe_summary", "source_repo", "upgrade_channel"],
        "rationale": "Reusable assets should be suggested to DAD with provenance and pointers so the library can classify them."
      },
      "applies_when": ["The asset is reusable beyond the source repo and can be described without raw private content."],
      "does_not_apply_when": ["The artifact is routine source code, private-only, duplicate, or cannot be summarized safely."],
      "danger_if_missed": "DAD misses useful assets and future repos repeat work.",
      "review_status": "reviewed"
    },
    {
      "rule_id": "exception-capture-rule:harness-opportunity",
      "pattern_family": "harness",
      "description": "A repeated coding, testing, red-team, or governance workflow should become a harness candidate.",
      "min_capture_surface_version": "0.1.0",
      "match_signals": ["new_coding_harness", "cross_repo_reuse"],
      "any_signals": ["validation_command", "labeled_eval_case", "red_team_rubric"],
      "suppress_signals": [],
      "emit": {
        "packet_classes": ["ordinary_mail"],
        "mail_message_type": "capability_suggestion",
        "exception_event_type": "",
        "capture_contract": "",
        "severity": "info",
        "required_fields": ["harness_family", "safe_summary", "validation_refs", "known_limits"],
        "rationale": "Coding-improvement harnesses should enter DAD's harness library as candidate capabilities."
      },
      "applies_when": ["The workflow can be reused by Codex, Claude, Cursor, or future agents."],
      "does_not_apply_when": ["The workflow is one-off, unvalidated, or requires private raw data."],
      "danger_if_missed": "High-leverage coding improvements stay trapped in one repo or chat.",
      "review_status": "reviewed"
    },
    {
      "rule_id": "exception-capture-rule:language-frontier-signal",
      "pattern_family": "language_frontier",
      "description": "A repo found a Python, Rust, mixed-language, or future-language coding technique, tool, library, codebase pattern, or proof operation that may improve AI coding.",
      "min_capture_surface_version": "0.2.0",
      "match_signals": ["language_frontier_signal"],
      "any_signals": [
        "python_coding_advantage",
        "rust_coding_advantage",
        "mixed_language_boundary",
        "future_language_proof_surface",
        "ai_overlooked_operation",
        "frontier_source_pointer"
      ],
      "suppress_signals": [
        "contains_private_rows",
        "contains_raw_log_blob",
        "contains_secret_or_pii"
      ],
      "emit": {
        "packet_classes": ["ordinary_mail"],
        "mail_message_type": "capability_suggestion",
        "exception_event_type": "",
        "capture_contract": "",
        "severity": "info",
        "required_fields": [
          "applicability_limits",
          "language",
          "proof_surface",
          "safe_summary",
          "source_id_or_url",
          "target_dad_surface",
          "validation_or_eval_idea",
          "why_ai_coding_may_improve"
        ],
        "rationale": "Language-frontier signals should enter DAD as pointer-only candidate evidence routed to language assets, coding harnesses, or tactic radar before any guidance changes."
      },
      "applies_when": [
        "A repo validates, falsifies, or discovers a Python, Rust, mixed-language, or future-language coding improvement that could help other AI coding agents.",
        "A codebase or source-watch pass finds an underused operation or proof surface that generic AI agents are likely to miss."
      ],
      "does_not_apply_when": [
        "The evidence is copied third-party docs, copied source, raw benchmark tables, raw logs, private rows, or credentials.",
        "The finding cannot name a source pointer, applicability limit, proof surface, and local validation or eval idea."
      ],
      "danger_if_missed": "DAD's language guidance and harness library fall behind real repo learning, and future agents keep coding from generic GitHub-shaped habits instead of local proof surfaces.",
      "review_status": "reviewed"
    },
    {
      "rule_id": "exception-capture-rule:skill-lifecycle",
      "pattern_family": "skill",
      "description": "A repo created, updated, retired, or replaced an agent skill or skill pointer.",
      "min_capture_surface_version": "0.1.0",
      "match_signals": ["agent_skill_change"],
      "any_signals": ["skill_created", "skill_updated", "skill_retired", "skill_pointer_needed"],
      "suppress_signals": [],
      "emit": {
        "packet_classes": ["ordinary_mail"],
        "mail_message_type": "capability_suggestion",
        "exception_event_type": "",
        "capture_contract": "",
        "severity": "info",
        "required_fields": ["skill_id", "version", "when_to_use", "when_not_to_use", "replacement_path"],
        "rationale": "DAD is the skill library and must know lifecycle updates without copying full skills into repos."
      },
      "applies_when": ["The skill affects future AI agent behavior or should be checked out by other repos."],
      "does_not_apply_when": ["The change is private scratch prompt text or not safe to summarize."],
      "danger_if_missed": "Agents use stale or conflicting skill guidance.",
      "review_status": "reviewed"
    },
    {
      "rule_id": "exception-capture-rule:template-update",
      "pattern_family": "template",
      "description": "A reusable template, managed block, or downstream pointer contract changed.",
      "min_capture_surface_version": "0.1.0",
      "match_signals": ["template_contract_change"],
      "any_signals": ["managed_block_change", "downstream_readme_change", "pointer_template_change"],
      "suppress_signals": [],
      "emit": {
        "packet_classes": ["ordinary_mail"],
        "mail_message_type": "workflow_suggestion",
        "exception_event_type": "",
        "capture_contract": "",
        "severity": "info",
        "required_fields": ["template_id", "changed_contract", "upgrade_policy", "validation_refs"],
        "rationale": "Repos using templates need candidate upgrade notices and local review paths."
      },
      "applies_when": ["The template may affect enrolled repo behavior or future repo starts."],
      "does_not_apply_when": ["The edit is local wording with no contract, cadence, or managed-surface effect."],
      "danger_if_missed": "Downstream repos retain stale instructions and miss new capture obligations.",
      "review_status": "reviewed"
    },
    {
      "rule_id": "exception-capture-rule:structured-workflow-review-gap",
      "pattern_family": "workflow",
      "description": "A structured review workflow created reusable DAD mail or issue logic but exposed an exception-lake or governance gap.",
      "min_capture_surface_version": "0.2.0",
      "match_signals": ["structured_review_issue_workflow", "exception_lake_mapping_gap"],
      "any_signals": ["budget_output_expectation_gap", "schema_model_cli_tests_docs", "cross_repo_reuse"],
      "suppress_signals": [],
      "emit": {
        "packet_classes": ["ordinary_mail", "exception_event"],
        "mail_message_type": "workflow_suggestion",
        "exception_event_type": "review_finding",
        "capture_contract": "review_finding",
        "severity": "high",
        "required_fields": ["workflow_summary", "issue_classes", "validation_refs", "exception_mapping_gap"],
        "rationale": "The LawFirm-os-intake missed-capture specimen should create both workflow mail and an exception seed automatically."
      },
      "applies_when": ["A review workflow yields reusable structure plus a gap DAD should learn from."],
      "does_not_apply_when": ["The review is private, unstructured, or has no reusable workflow/gap evidence."],
      "danger_if_missed": "Lowell has to notice the pattern manually and DAD fails to learn from review work.",
      "review_status": "reviewed"
    },
    {
      "rule_id": "exception-capture-rule:architecture-reference",
      "pattern_family": "architecture_reference",
      "description": "A repo produced a reusable architecture reference, design pattern, or buildout map.",
      "min_capture_surface_version": "0.1.0",
      "match_signals": ["architecture_reference_created"],
      "any_signals": ["system_diagram", "rollout_wave_plan", "control_plane_design"],
      "suppress_signals": [],
      "emit": {
        "packet_classes": ["ordinary_mail"],
        "mail_message_type": "workflow_suggestion",
        "exception_event_type": "",
        "capture_contract": "",
        "severity": "info",
        "required_fields": ["architecture_ref", "applies_when", "does_not_apply_when", "authority_boundary"],